{
  "demo_notice": "DEMO DATA — NOT A REAL STUDENT PROFILE.",
  "user_id": "example-user",
  "profile": {
    "academic": {
      "university": "HCMUS",
      "major": "Information Technology",
      "academic_year": 2,
      "current_gpa": 3.25,
      "gpa_scale": 4,
      "earned_credits": 65,
      "training_score": null
    },
    "preferences": {
      "language": "vi",
      "response_style": "detailed"
    },
    "interests": {
      "research_topics": [],
      "club_interests": [],
      "career_interests": []
    },
    "current_goals": [
      "evaluate scholarship eligibility",
      "plan next semester"
    ]
  },
  "metadata": {
    "user_confirmed": true,
    "consent_to_store": false,
    "last_updated": "EXAMPLE_ONLY"
  }
}
